{
  "version": "1",
  "nodes": [
    {
      "id": "column:customers.customer_id",
      "kind": "column",
      "name": "customer_id",
      "qualified_name": "customers.customer_id",
      "evidence": [
        {
          "file": "compiled/customers.sql",
          "expression": "customers.customer_id",
          "confidence": "high"
        }
      ],
      "derivation": {
        "status": "partial",
        "confidence": "medium",
        "source": "dbt_manifest",
        "errors": []
      }
    },
    {
      "id": "column:customers.customer_lifetime_value",
      "kind": "column",
      "name": "customer_lifetime_value",
      "qualified_name": "customers.customer_lifetime_value",
      "evidence": [
        {
          "file": "/Users/jonkim/Local Docs/Development/clearmetric-labs/ClearMetric-Core/packages/clearmetric-core/tests/fixtures/wedge/jaffle_warehouse_schema.json",
          "expression": "customers.customer_lifetime_value",
          "confidence": "high"
        },
        {
          "file": "compiled/customers.sql",
          "expression": "customers.customer_lifetime_value",
          "confidence": "high"
        }
      ],
      "derivation": {
        "status": "complete",
        "confidence": "high",
        "source": "information_schema",
        "errors": []
      },
      "bindings": [
        {
          "warehouse": "jaffle",
          "table": "customers",
          "column": "customer_lifetime_value"
        }
      ],
      "aspects": {
        "warehouse_metadata": {
          "data_type": "number",
          "nullable": null,
          "ordinal_position": null,
          "comment": null
        }
      }
    },
    {
      "id": "column:customers.first_name",
      "kind": "column",
      "name": "first_name",
      "qualified_name": "customers.first_name",
      "evidence": [
        {
          "file": "compiled/customers.sql",
          "expression": "customers.first_name",
          "confidence": "high"
        }
      ],
      "derivation": {
        "status": "partial",
        "confidence": "medium",
        "source": "dbt_manifest",
        "errors": []
      }
    },
    {
      "id": "column:customers.first_order",
      "kind": "column",
      "name": "first_order",
      "qualified_name": "customers.first_order",
      "evidence": [
        {
          "file": "compiled/customers.sql",
          "expression": "customers.first_order",
          "confidence": "high"
        }
      ],
      "derivation": {
        "status": "partial",
        "confidence": "medium",
        "source": "dbt_manifest",
        "errors": []
      }
    },
    {
      "id": "column:customers.last_name",
      "kind": "column",
      "name": "last_name",
      "qualified_name": "customers.last_name",
      "evidence": [
        {
          "file": "compiled/customers.sql",
          "expression": "customers.last_name",
          "confidence": "high"
        }
      ],
      "derivation": {
        "status": "partial",
        "confidence": "medium",
        "source": "dbt_manifest",
        "errors": []
      }
    },
    {
      "id": "column:customers.most_recent_order",
      "kind": "column",
      "name": "most_recent_order",
      "qualified_name": "customers.most_recent_order",
      "evidence": [
        {
          "file": "compiled/customers.sql",
          "expression": "customers.most_recent_order",
          "confidence": "high"
        }
      ],
      "derivation": {
        "status": "partial",
        "confidence": "medium",
        "source": "dbt_manifest",
        "errors": []
      }
    },
    {
      "id": "column:customers.number_of_orders",
      "kind": "column",
      "name": "number_of_orders",
      "qualified_name": "customers.number_of_orders",
      "evidence": [
        {
          "file": "compiled/customers.sql",
          "expression": "customers.number_of_orders",
          "confidence": "high"
        }
      ],
      "derivation": {
        "status": "partial",
        "confidence": "medium",
        "source": "dbt_manifest",
        "errors": []
      }
    },
    {
      "id": "column:orders.amount",
      "kind": "column",
      "name": "amount",
      "qualified_name": "orders.amount",
      "evidence": [
        {
          "file": "/Users/jonkim/Local Docs/Development/clearmetric-labs/ClearMetric-Core/packages/clearmetric-core/tests/fixtures/wedge/jaffle_warehouse_schema.json",
          "expression": "orders.amount",
          "confidence": "high"
        },
        {
          "file": "compiled/orders.sql",
          "expression": "orders.amount",
          "confidence": "high"
        }
      ],
      "derivation": {
        "status": "complete",
        "confidence": "high",
        "source": "information_schema",
        "errors": []
      },
      "bindings": [
        {
          "warehouse": "jaffle",
          "table": "orders",
          "column": "amount"
        }
      ],
      "aspects": {
        "warehouse_metadata": {
          "data_type": "number",
          "nullable": null,
          "ordinal_position": null,
          "comment": null
        }
      }
    },
    {
      "id": "column:orders.bank_transfer_amount",
      "kind": "column",
      "name": "bank_transfer_amount",
      "qualified_name": "orders.bank_transfer_amount",
      "evidence": [
        {
          "file": "compiled/orders.sql",
          "expression": "orders.bank_transfer_amount",
          "confidence": "high"
        }
      ],
      "derivation": {
        "status": "partial",
        "confidence": "medium",
        "source": "dbt_manifest",
        "errors": []
      }
    },
    {
      "id": "column:orders.coupon_amount",
      "kind": "column",
      "name": "coupon_amount",
      "qualified_name": "orders.coupon_amount",
      "evidence": [
        {
          "file": "compiled/orders.sql",
          "expression": "orders.coupon_amount",
          "confidence": "high"
        }
      ],
      "derivation": {
        "status": "partial",
        "confidence": "medium",
        "source": "dbt_manifest",
        "errors": []
      }
    },
    {
      "id": "column:orders.credit_card_amount",
      "kind": "column",
      "name": "credit_card_amount",
      "qualified_name": "orders.credit_card_amount",
      "evidence": [
        {
          "file": "compiled/orders.sql",
          "expression": "orders.credit_card_amount",
          "confidence": "high"
        }
      ],
      "derivation": {
        "status": "partial",
        "confidence": "medium",
        "source": "dbt_manifest",
        "errors": []
      }
    },
    {
      "id": "column:orders.customer_id",
      "kind": "column",
      "name": "customer_id",
      "qualified_name": "orders.customer_id",
      "evidence": [
        {
          "file": "compiled/orders.sql",
          "expression": "orders.customer_id",
          "confidence": "high"
        }
      ],
      "derivation": {
        "status": "partial",
        "confidence": "medium",
        "source": "dbt_manifest",
        "errors": []
      }
    },
    {
      "id": "column:orders.gift_card_amount",
      "kind": "column",
      "name": "gift_card_amount",
      "qualified_name": "orders.gift_card_amount",
      "evidence": [
        {
          "file": "compiled/orders.sql",
          "expression": "orders.gift_card_amount",
          "confidence": "high"
        }
      ],
      "derivation": {
        "status": "partial",
        "confidence": "medium",
        "source": "dbt_manifest",
        "errors": []
      }
    },
    {
      "id": "column:orders.order_date",
      "kind": "column",
      "name": "order_date",
      "qualified_name": "orders.order_date",
      "evidence": [
        {
          "file": "compiled/orders.sql",
          "expression": "orders.order_date",
          "confidence": "high"
        }
      ],
      "derivation": {
        "status": "partial",
        "confidence": "medium",
        "source": "dbt_manifest",
        "errors": []
      }
    },
    {
      "id": "column:orders.order_id",
      "kind": "column",
      "name": "order_id",
      "qualified_name": "orders.order_id",
      "evidence": [
        {
          "file": "compiled/orders.sql",
          "expression": "orders.order_id",
          "confidence": "high"
        }
      ],
      "derivation": {
        "status": "partial",
        "confidence": "medium",
        "source": "dbt_manifest",
        "errors": []
      }
    },
    {
      "id": "column:orders.status",
      "kind": "column",
      "name": "status",
      "qualified_name": "orders.status",
      "evidence": [
        {
          "file": "compiled/orders.sql",
          "expression": "orders.status",
          "confidence": "high"
        }
      ],
      "derivation": {
        "status": "partial",
        "confidence": "medium",
        "source": "dbt_manifest",
        "errors": []
      }
    },
    {
      "id": "column:raw_customers.first_name",
      "kind": "column",
      "name": "first_name",
      "qualified_name": "raw_customers.first_name",
      "evidence": [
        {
          "file": "/Users/jonkim/Local Docs/Development/clearmetric-labs/ClearMetric-Core/packages/clearmetric-core/tests/fixtures/wedge/jaffle_warehouse_schema.json",
          "expression": "raw_customers.first_name",
          "confidence": "high"
        }
      ],
      "derivation": {
        "status": "complete",
        "confidence": "high",
        "source": "information_schema",
        "errors": []
      },
      "bindings": [
        {
          "warehouse": "jaffle",
          "table": "raw_customers",
          "column": "first_name"
        }
      ],
      "aspects": {
        "warehouse_metadata": {
          "data_type": "text",
          "nullable": null,
          "ordinal_position": null,
          "comment": null
        }
      }
    },
    {
      "id": "column:raw_customers.id",
      "kind": "column",
      "name": "id",